{
     "sourceDbName":"WORK_SHARED_DIM_DB",
     "sourceTableName":"TF_TABLE_NAME",
     "targetDbName":"GOLD_SHARED_DIM_DB",
     "targetTableName":"TRGT_DIM_TABLE_NAME",
     "surrogateKey":"market_key",
     "columns":[
       {"name":"market_id","isKeyColumn":"true","isNonKeyColumn":"false","isDateColumn":"false"},
       {"name":"market_nm","isKeyColumn":"false","isNonKeyColumn":"true","isDateColumn":"false"}
     ], 
     "workDbName":"WORK_SHARED_DIM_DB",
     "workTableName":"WORK_DIM_TABLE_NAME",
     "cdcPigFileForDim":"dim_market"
}