{
     "sourceDbName":"WORK_SHARED_DIM_DB",
     "sourceTableName":"TF_TABLE_NAME",
     "targetDbName":"GOLD_SHARED_DIM_DB",
     "targetTableName":"TRGT_DIM_TABLE_NAME",
     "surrogateKey":"category_key",
     "columns":[
       {"name":"category_id","isKeyColumn":"true","isNonKeyColumn":"false","isDateColumn":"false"},
       {"name":"category","isKeyColumn":"false","isNonKeyColumn":"true","isDateColumn":"false"},
       {"name":"legacy_category","isKeyColumn":"false","isNonKeyColumn":"true","isDateColumn":"false"},
       {"name":"new_world_category","isKeyColumn":"false","isNonKeyColumn":"true","isDateColumn":"false"},
       {"name":"additional_category_nm","isKeyColumn":"false","isNonKeyColumn":"true","isDateColumn":"false"},
       {"name":"is_active","isKeyColumn":"false","isNonKeyColumn":"true","isDateColumn":"false"},
       {"name":"category_group","isKeyColumn":"false","isNonKeyColumn":"true","isDateColumn":"false"},
       {"name":"category_group_type","isKeyColumn":"false","isNonKeyColumn":"true","isDateColumn":"false"}
     ], 
     "workDbName":"WORK_SHARED_DIM_DB",
     "workTableName":"WORK_DIM_TABLE_NAME",
     "cdcPigFileForDim":"dim_category"
}